{
  "authorization_id": "b2c3d4e5-f6a7-8901-bcde-f23456789012",
  "request_id": "a1b2c3d4-e5f6-7890-abcd-ef1234567890",
  "risk_evaluation_id": "f7e8d9c0-b1a2-3456-cdef-789012345678",
  "decision": "approve",
  "authorized_by": {
    "authorizer_id": "user-cfo-0001",
    "display_name": "Sarah Mitchell",
    "identity_verified": true,
    "identity_method": "face_id"
  },
  "authorization_role": "finance_approver",
  "authorization_method": "mobile_biometric",
  "authorized_at": "2026-03-24T14:33:42.108Z",
  "expires_at": "2026-03-24T14:38:42.108Z",
  "co_authorizers": [],
  "conditions": [],
  "notes": "Invoice verified against contract MSA-2024-0042. Amount matches expected Q1 materials order. Approved for immediate execution.",
  "signature": {
    "algorithm": "ECDSA-secp256k1",
    "public_key_id": "key-sarah-mitchell-2026-01",
    "signature_value": "MEUCIQC7xK9pVz3mFnR4j8Hb2LwQp5YtN6vXcD1eA0fGhIjKlMnOpQrStUvWxYzAbCdEfGhIjKlMnOpQrStUvWxYz0123456789ABCDEFGHIJKLMNOPQRSTUVWXYZabcdefghijklmnop==",
    "signed_fields_hash": "a3f2b8c1d4e5f6a7b8c9d0e1f2a3b4c5d6e7f8a9b0c1d2e3f4a5b6c7d8e9f0a1",
    "nonce": "nonce-20260324-143342-7f8e9d0c"
  }
}
